[
  {
    "payloadType": "application/vnd.codicarium.command-evidence+jcs",
    "payload": "eyJjb21tYW5kX2lkIjoiQ01ELTAxLUJBU0VMSU5FLUlOVkVOVE9SWSIsImRhZ19ub2RlX2lkIjoiUzAwIiwiZGF0YSI6eyJlZmZlY3RfY291bnQiOjAsImV4cGVjdGVkIjp7InJlc3VsdCI6IlBBU1MifSwibmVnYXRpdmVfb3JhY2xlcyI6WyJ3cm9uZyBpZGVudGl0eSIsIndyb25nIHRhcmdldCIsInN0YWxlIGV2aWRlbmNlIiwibm9uY2UgcmVwbGF5IiwicHJlZGljYXRlIG1pc21hdGNoIl0sIm9ic2VydmVkIjp7InJlc3VsdCI6IlBBU1MifSwib3BlcmF0aW9uIjoiYmFzZWxpbmUtaW52ZW50b3J5IiwicG9zaXRpdmVfb3JhY2xlIjoiUmVjb21wdXRlIFBSRUQtMDEtQkFTRUxJTkUtSU5WRU5UT1JZIGZyb20gY2Fub25pY2FsIHJhdyBpbnB1dCBieXRlcyIsInN1YmplY3RfaWQiOiJzeW50aGV0aWMtZml4dHVyZSIsInRhcmdldF9pZCI6Im5vbi1saXZlLXRhcmdldCJ9LCJvYnNlcnZhdGlvbiI6eyJhdXRob3JpdHlfY2xhaW0iOnsiZXBvY2giOjAsInNlcXVlbmNlIjowLCJ3b3JrX2l0ZW1faWQiOiJmaXh0dXJlLW9ubHkifSwiZXZpZGVuY2VfY2xhc3MiOiJzeW50aGV0aWMiLCJleHBpcmVzX2F0IjoiMjAyNi0wOC0yNlQxMDowNTowMFoiLCJpc3N1ZWRfYXQiOiIyMDI2LTA4LTI2VDEwOjAwOjAwWiIsIm5vbmNlIjoiYmI1Mzc5NjVlZDA2OGY5MzQ5MjcwNjk4Mzc5NzVmNGUxYTIxZTA0MmRlNzIwNjY5MzY4YWIzZmJmY2FiMGU3NiIsIm5vdF9iZWZvcmUiOiIyMDI2LTA4LTI2VDEwOjAwOjAwWiIsInBheWxvYWRfc2hhMjU2IjoiMTFiYTkzYWRhY2FmYzRhZWUxOGY4YTE4MWE5YzllYTE5ZDBmZWQ3NWY1ZDk1ZDQwNjVlNmNhYTRjZGQwMmMyNyIsInJlcXVlc3Rfc2hhMjU2IjoiNmI3MDEwYTE1NzM2NGQ3YTU5MTAxYzcwNTMxNDczZjIxZmU5OTI2NmU2MDIyZmVjYWM4OTMwYTAzMjA1ZGI0NCJ9LCJwcmVkaWNhdGUiOnsiY29tcHV0ZWRfYXQiOiIyMDI2LTA4LTI2VDEwOjAwOjAwWiIsImV2YWx1YXRvcl9zaGEyNTYiOiIwMjdlZTQ3YzllYjE3ZTFkNTI1NWFlNTcxMzFjZDczN2YxYTliYWY2NzQzNzNhYzM1NDQ0MzY2NDFmYzVmYTNlIiwiaWQiOiJQUkVELTAxLUJBU0VMSU5FLUlOVkVOVE9SWSIsImlucHV0c19zaGEyNTYiOiIzM2JkZTQ3MWM5ZTk3MjYzY2ZiMjE5NmJhMmM2ZmY2OThjNzIwNTQzNTBkOWI0NTExZjdmYTMzYjM4ZjUyOThkIiwibWF4X2FnZV9zZWNvbmRzIjozMDAsInJlc3VsdCI6IlBBU1MifSwic2NoZW1hIjoiY29kaWNhcml1bS5iYXNlbGluZS1pbnZlbnRvcnkvdjIiLCJzdWJqZWN0Ijp7ImtpbmQiOiJnaXRodWItd29ya2Zsb3ciLCJyZXBvc2l0b3J5IjoiY29kaWNhcml1bS9jb2RpY2FyaXVtLWFjdGlvbnMiLCJydW5fYXR0ZW1wdCI6MSwicnVuX2lkIjoxLCJ3b3JrZmxvd19yZWYiOiJyZWZzL2hlYWRzL21haW46LmdpdGh1Yi93b3JrZmxvd3MvZXZpZGVuY2UueW1sIiwid29ya2Zsb3dfc2hhIjoiOTU0NWI1YTY2NDk4ZjY3NjY3ZTU3ZDAyMTUwN2FjMDYwZmQwMTZiNiJ9LCJ0YXJnZXQiOnsiaW1tdXRhYmxlX2lkIjoiZml4dHVyZS0xIiwia2luZCI6ImdpdGh1YiIsIm9iamVjdCI6ImJhc2VsaW5lLWludmVudG9yeSIsInJlcG9zaXRvcnkiOiJjb2RpY2FyaXVtL2RlcGxveW1lbnQtY29udHJvbGxlciIsInJlcG9zaXRvcnlfaWQiOjF9fQ==",
    "signatures": [
      {
        "keyid": "fixture-ed25519-rfc8032-seed",
        "sig": "0A51x+L2ChVT84wHhpWAyVMq4CPqj2wUuflAQfvwYkJ03WOGGIp1lz0c2c6ihrpyy8LNv73d3Gy8GtVqEGmwBg=="
      }
    ],
    "signer": {
      "kind": "test-only-ed25519/v1",
      "issuer": "fixture",
      "subject": "fixture-only",
      "workflow_ref": "none",
      "workflow_sha": "0000000000000000000000000000000000000000",
      "public_key_spki": "MCowBQYDK2VwAyEAA6EHv/POEL4dcN0Y50vAmWfk1jCbpQ1fHdyGZBJVMbg="
    },
    "publication_authority": false
  },
  {
    "payloadType": "application/vnd.codicarium.command-evidence+jcs",
    "payload": "eyJjb21tYW5kX2lkIjoiQ01ELTAyLUNPVU5DSUwtREVDSVNJT04iLCJkYWdfbm9kZV9pZCI6IlMwMSIsImRhdGEiOnsiZWZmZWN0X2NvdW50IjowLCJleHBlY3RlZCI6eyJyZXN1bHQiOiJQQVNTIn0sIm5lZ2F0aXZlX29yYWNsZXMiOlsid3JvbmcgaWRlbnRpdHkiLCJ3cm9uZyB0YXJnZXQiLCJzdGFsZSBldmlkZW5jZSIsIm5vbmNlIHJlcGxheSIsInByZWRpY2F0ZSBtaXNtYXRjaCJdLCJvYnNlcnZlZCI6eyJyZXN1bHQiOiJQQVNTIn0sIm9wZXJhdGlvbiI6ImNvdW5jaWwtZGVjaXNpb24iLCJwb3NpdGl2ZV9vcmFjbGUiOiJSZWNvbXB1dGUgUFJFRC0wMi1DT1VOQ0lMLURFQ0lTSU9OIGZyb20gY2Fub25pY2FsIHJhdyBpbnB1dCBieXRlcyIsInN1YmplY3RfaWQiOiJzeW50aGV0aWMtZml4dHVyZSIsInRhcmdldF9pZCI6Im5vbi1saXZlLXRhcmdldCJ9LCJvYnNlcnZhdGlvbiI6eyJhdXRob3JpdHlfY2xhaW0iOnsiZXBvY2giOjAsInNlcXVlbmNlIjoxLCJ3b3JrX2l0ZW1faWQiOiJmaXh0dXJlLW9ubHkifSwiZXZpZGVuY2VfY2xhc3MiOiJzeW50aGV0aWMiLCJleHBpcmVzX2F0IjoiMjAyNi0wOC0yNlQxMDowNTowMFoiLCJpc3N1ZWRfYXQiOiIyMDI2LTA4LTI2VDEwOjAwOjAwWiIsIm5vbmNlIjoiOWMwMWQyZDQ4NmQwN2RlODliNGMwMTNhZDRjYjQ3YzhmOGNhYzFjYmEyMTgzYjE5NjMzOGNmYjJkNWFlMzQ5MCIsIm5vdF9iZWZvcmUiOiIyMDI2LTA4LTI2VDEwOjAwOjAwWiIsInBheWxvYWRfc2hhMjU2IjoiNDZhZTA4ODliNDY4OWU0ZGRhOTgyNWM3ZTBlMWI5NjJlYTlhNzg1MjZlMmI5MmE5YmE2N2Y0NjJiZGNhZjNiNSIsInJlcXVlc3Rfc2hhMjU2IjoiMzM3MmI2ZWI2Y2VjNTljZDAyZmUxYjJjYTM0YTkzOTM4Y2E5NWViYzA5MmI1NTRmN2Q5NTAwZjZlZmY0Y2ViOCJ9LCJwcmVkaWNhdGUiOnsiY29tcHV0ZWRfYXQiOiIyMDI2LTA4LTI2VDEwOjAwOjAwWiIsImV2YWx1YXRvcl9zaGEyNTYiOiIwNGU3NWRkMzc2NjNhYjE0NzU2OThjOGM4M2E0MjdkZWRhNGZlMDQyODQ2Yjg0MDg4MDM3NmYxMGUyYzcwZGRmIiwiaWQiOiJQUkVELTAyLUNPVU5DSUwtREVDSVNJT04iLCJpbnB1dHNfc2hhMjU2IjoiODhiYjRiMzJkMzE4YzMzYmUxM2ZlMGZhMTNkOWQ1YzYwYTU2YWRmN2VhMWYxMDdhM2ZkZTI2MjYyN2Q5OWRhOCIsIm1heF9hZ2Vfc2Vjb25kcyI6MzAwLCJyZXN1bHQiOiJQQVNTIn0sInNjaGVtYSI6ImNvZGljYXJpdW0uY291bmNpbC1kZWNpc2lvbi92MiIsInN1YmplY3QiOnsia2luZCI6ImdpdGh1Yi13b3JrZmxvdyIsInJlcG9zaXRvcnkiOiJjb2RpY2FyaXVtL2NvZGljYXJpdW0tYWN0aW9ucyIsInJ1bl9hdHRlbXB0IjoxLCJydW5faWQiOjIsIndvcmtmbG93X3JlZiI6InJlZnMvaGVhZHMvbWFpbjouZ2l0aHViL3dvcmtmbG93cy9ldmlkZW5jZS55bWwiLCJ3b3JrZmxvd19zaGEiOiI5NTQ1YjVhNjY0OThmNjc2NjdlNTdkMDIxNTA3YWMwNjBmZDAxNmI2In0sInRhcmdldCI6eyJpbW11dGFibGVfaWQiOiJmaXh0dXJlLTIiLCJraW5kIjoiZ2l0aHViIiwib2JqZWN0IjoiY291bmNpbC1kZWNpc2lvbiIsInJlcG9zaXRvcnkiOiJjb2RpY2FyaXVtL2RlcGxveW1lbnQtY29udHJvbGxlciIsInJlcG9zaXRvcnlfaWQiOjF9fQ==",
    "signatures": [
      {
        "keyid": "fixture-ed25519-rfc8032-seed",
        "sig": "um5mFcjEvQtrg17qdpAWtxHGRrqKBGEu7n9d+CQQUYie4G6vi4Qu6PsZIk09ZFFTtyI+ZhDfjNxdt5kCI1ZpBg=="
      }
    ],
    "signer": {
      "kind": "test-only-ed25519/v1",
      "issuer": "fixture",
      "subject": "fixture-only",
      "workflow_ref": "none",
      "workflow_sha": "0000000000000000000000000000000000000000",
      "public_key_spki": "MCowBQYDK2VwAyEAA6EHv/POEL4dcN0Y50vAmWfk1jCbpQ1fHdyGZBJVMbg="
    },
    "publication_authority": false
  },
  {
    "payloadType": "application/vnd.codicarium.command-evidence+jcs",
    "payload": "eyJjb21tYW5kX2lkIjoiQ01ELTAzLVJFUE9TSVRPUlktQ1JFQVRFIiwiZGFnX25vZGVfaWQiOiJCMTAiLCJkYXRhIjp7ImVmZmVjdF9jb3VudCI6MCwiZXhwZWN0ZWQiOnsicmVzdWx0IjoiUEFTUyJ9LCJuZWdhdGl2ZV9vcmFjbGVzIjpbIndyb25nIGlkZW50aXR5Iiwid3JvbmcgdGFyZ2V0Iiwic3RhbGUgZXZpZGVuY2UiLCJub25jZSByZXBsYXkiLCJwcmVkaWNhdGUgbWlzbWF0Y2giXSwib2JzZXJ2ZWQiOnsicmVzdWx0IjoiUEFTUyJ9LCJvcGVyYXRpb24iOiJyZXBvc2l0b3J5LWNyZWF0ZSIsInBvc2l0aXZlX29yYWNsZSI6IlJlY29tcHV0ZSBQUkVELTAzLVJFUE9TSVRPUlktQ1JFQVRFIGZyb20gY2Fub25pY2FsIHJhdyBpbnB1dCBieXRlcyIsInN1YmplY3RfaWQiOiJzeW50aGV0aWMtZml4dHVyZSIsInRhcmdldF9pZCI6Im5vbi1saXZlLXRhcmdldCJ9LCJvYnNlcnZhdGlvbiI6eyJhdXRob3JpdHlfY2xhaW0iOnsiZXBvY2giOjAsInNlcXVlbmNlIjoyLCJ3b3JrX2l0ZW1faWQiOiJmaXh0dXJlLW9ubHkifSwiZXZpZGVuY2VfY2xhc3MiOiJzeW50aGV0aWMiLCJleHBpcmVzX2F0IjoiMjAyNi0wOC0yNlQxMDowNTowMFoiLCJpc3N1ZWRfYXQiOiIyMDI2LTA4LTI2VDEwOjAwOjAwWiIsIm5vbmNlIjoiMDk3Y2JmNjIyOTg5NTQ3YTRjNTcxNGMwNTJiMzlhNmE0OGY5Y2I5YTZhNjJjMTQ4MDE4ZGE4NDc1YWNiYWYzYyIsIm5vdF9iZWZvcmUiOiIyMDI2LTA4LTI2VDEwOjAwOjAwWiIsInBheWxvYWRfc2hhMjU2IjoiOGRiMDQ3MzVmOGJkMzlhOTVhMGFlYjQwZjMzOTRiOTk5N2I5YzNiY2UyZjg2ZmMwMmFmOTNhZDI5ZmVkZmRjNSIsInJlcXVlc3Rfc2hhMjU2IjoiMGIwZTJmNThjNzgwOGJlOTU0YjM4ZmY3MDYwNmUwMDdjOWEyODE0ZmJkNzgxMDA2YmFlYmQxYmFlZTM1ZGYxMCJ9LCJwcmVkaWNhdGUiOnsiY29tcHV0ZWRfYXQiOiIyMDI2LTA4LTI2VDEwOjAwOjAwWiIsImV2YWx1YXRvcl9zaGEyNTYiOiI5NDI5NDlhM2Q2OTNmMGNhN2M5NDZiMmFhNjUyMzQ0ZDI3ZDdmMDEzN2VlOGVhYWM5NjM5ZWY1ZDM1MjU5Mzc0IiwiaWQiOiJQUkVELTAzLVJFUE9TSVRPUlktQ1JFQVRFIiwiaW5wdXRzX3NoYTI1NiI6IjJjOWU3ZjQwODRmNGQ1MzQ5MzMxZmMzZGQzNTc4MjEzODE2ODU1OGUwODRlYmQzMzNlMGE5MTkzZmMyNjliZTQiLCJtYXhfYWdlX3NlY29uZHMiOjMwMCwicmVzdWx0IjoiUEFTUyJ9LCJzY2hlbWEiOiJjb2RpY2FyaXVtLnJlcG9zaXRvcnktY3JlYXRlL3YyIiwic3ViamVjdCI6eyJraW5kIjoiZ2l0aHViLXdvcmtmbG93IiwicmVwb3NpdG9yeSI6ImNvZGljYXJpdW0vY29kaWNhcml1bS1hY3Rpb25zIiwicnVuX2F0dGVtcHQiOjEsInJ1bl9pZCI6Mywid29ya2Zsb3dfcmVmIjoicmVmcy9oZWFkcy9tYWluOi5naXRodWIvd29ya2Zsb3dzL2V2aWRlbmNlLnltbCIsIndvcmtmbG93X3NoYSI6Ijk1NDViNWE2NjQ5OGY2NzY2N2U1N2QwMjE1MDdhYzA2MGZkMDE2YjYifSwidGFyZ2V0Ijp7ImltbXV0YWJsZV9pZCI6ImZpeHR1cmUtMyIsImtpbmQiOiJnaXRodWIiLCJvYmplY3QiOiJyZXBvc2l0b3J5LWNyZWF0ZSIsInJlcG9zaXRvcnkiOiJjb2RpY2FyaXVtL2RlcGxveW1lbnQtY29udHJvbGxlciIsInJlcG9zaXRvcnlfaWQiOjF9fQ==",
    "signatures": [
      {
        "keyid": "fixture-ed25519-rfc8032-seed",
        "sig": "NTqy8qjUbw51W4y0o8fLZPr4AEAh+nBkQ0Ki6yLPV/mdR48cpYJGD5XiBGO2Ublg+xITOKs9EUDo+SqyV1uYBw=="
      }
    ],
    "signer": {
      "kind": "test-only-ed25519/v1",
      "issuer": "fixture",
      "subject": "fixture-only",
      "workflow_ref": "none",
      "workflow_sha": "0000000000000000000000000000000000000000",
      "public_key_spki": "MCowBQYDK2VwAyEAA6EHv/POEL4dcN0Y50vAmWfk1jCbpQ1fHdyGZBJVMbg="
    },
    "publication_authority": false
  },
  {
    "payloadType": "application/vnd.codicarium.command-evidence+jcs",